{
  "schema_version": 2,
  "ncarnate_version": "2.2.1",
  "operation": "convert",
  "plan_hash": "af65c9a7adf3e2479c4053723890b3de1cf9ea5b3d55d7a1639a8f988584c93a",
  "source": {
    "path": "/data/granules/AMSR_E_L3_SeaIce12km_V15_20070101.hdf",
    "detected_format": "HDF4",
    "size_bytes": 166692,
    "sha256": "8ddf6b407b461f5b6e4492f5ba59dcfadac1a0905aad965574707e298349c6d9"
  },
  "destination": {
    "path": "/data/out/amsre.nc",
    "container_format": "NETCDF4",
    "size_bytes": 10757576,
    "sha256": "2e5d99a9f6e6e9f6223e9854752522d2c4aee5ce37b53252daf0f8bac6f74dfc"
  },
  "options": {
    "zlib": true,
    "shuffle": true,
    "complevel": 7,
    "geolocation": true
  },
  "structure": {
    "path": "/",
    "dimensions": [],
    "attributes": [
      {
        "name": "HDFEOSVersion",
        "storage_type": "NC_CHAR",
        "value": "HDFEOS_V2.10"
      }
    ],
    "variables": [],
    "groups": [
      {
        "path": "/HDFEOS_INFORMATION",
        "dimensions": [],
        "attributes": [
          {
            "name": "CoreMetadata.0",
            "storage_type": "NC_CHAR",
            "value": "GROUP = INVENTORYMETADATA\n   GROUPTYPE = MASTERGROUP\n   GROUP = ECSDATAGRANULE\n      OBJECT = LOCALGRANULEID\n         NUM_VAL = 1\n         VALUE = \"AMSR_E_L3_SeaIce12km_B02_20020619.hdf\"\n      END_OBJECT = LOCALGRANULEID\n      OBJECT = PRODUCTIONDATETIME\n         NUM_VAL = 1\n         VALUE = \"2004-05-11T20:52:50Z\"\n      END_OBJECT = PRODUCTIONDATETIME\n   END_GROUP = ECSDATAGRANULE\n   GROUP = MEASUREDPARAMETER\n      OBJECT = MEASUREDPARAMETERCONTAINER\n         CLASS = \"1\"\n         OBJECT = PARAMETERNAME\n            NUM_VAL = 1\n            CLASS = \"1\"\n            VALUE = \"Sea Ice Parameters\"\n         END_OBJECT = PARAMETERNAME\n         GROUP = QAFLAGS\n            CLASS = \"1\"\n            OBJECT = AUTOMATICQUALITYFLAG\n               NUM_VAL = 1\n               CLASS = \"1\"\n               VALUE = \"Passed\"\n            END_OBJECT = AUTOMATICQUALITYFLAG\n            OBJECT = AUTOMATICQUALITYFLAGEXPLANATION\n               NUM_VAL = 1\n               CLASS = \"1\"\n               VALUE = \"Program Execution Completed\"\n            END_OBJECT = AUTOMATICQUALITYFLAGEXPLANATION\n            OBJECT = OPERATIONALQUALITYFLAG\n               NUM_VAL = 1\n               CLASS = \"1\"\n               VALUE = \"Not Investigated\"\n            END_OBJECT = OPERATIONALQUALITYFLAG\n            OBJECT = OPERATIONALQUALITYFLAGEXPLANATION\n               NUM_VAL = 1\n               CLASS = \"1\"\n               VALUE = \"Currently not used\"\n            END_OBJECT = OPERATIONALQUALITYFLAGEXPLANATION\n            OBJECT = SCIENCEQUALITYFLAG\n               NUM_VAL = 1\n               CLASS = \"1\"\n               VALUE = \"Not Investigated\"\n            END_OBJECT = SCIENCEQUALITYFLAG\n            OBJECT = SCIENCEQUALITYFLAGEXPLANATION\n               NUM_VAL = 1\n               CLASS = \"1\"\n               VALUE = \"Currently not used\"\n            END_OBJECT = SCIENCEQUALITYFLAGEXPLANATION\n         END_GROUP = QAFLAGS\n         GROUP = QASTATS\n            CLASS = \"1\"\n            OBJECT = QAPERCENTMISSINGDATA\n               NUM_VAL = 1\n               CLASS = \"1\"\n               VALUE = 0\n            END_OBJECT = QAPERCENTMISSINGDATA\n            OBJECT = QAPERCENTOUTOFBOUNDSDATA\n               NUM_VAL = 1\n               CLASS = \"1\"\n               VALUE = 0\n            END_OBJECT = QAPERCENTOUTOFBOUNDSDATA\n         END_GROUP = QASTATS\n      END_OBJECT = MEASUREDPARAMETERCONTAINER\n   END_GROUP = MEASUREDPARAMETER\n   GROUP = COLLECTIONDESCRIPTIONCLASS\n      OBJECT = SHORTNAME\n         NUM_VAL = 1\n         VALUE = \"AE_SI12\"\n      END_OBJECT = SHORTNAME\n      OBJECT = VERSIONID\n         NUM_VAL = 1\n         VALUE = 1\n      END_OBJECT = VERSIONID\n   END_GROUP = COLLECTIONDESCRIPTIONCLASS\n   GROUP = INPUTGRANULE\n      OBJECT = INPUTPOINTER\n         NUM_VAL = 1\n         VALUE = \"AMSR_E_L2A_BrightnessTemperatures_B01_200206190029_D.hdf\"\n      END_OBJECT = INPUTPOINTER\n   END_GROUP = INPUTGRANULE\n   GROUP = SPATIALDOMAINCONTAINER\n      GROUP = HORIZONTALSPATIALDOMAINCONTAINER\n         GROUP = BOUNDINGRECTANGLE\n            OBJECT = WESTBOUNDINGCOORDINATE\n               NUM_VAL = 1\n               VALUE = -180.0\n            END_OBJECT = WESTBOUNDINGCOORDINATE\n            OBJECT = NORTHBOUNDINGCOORDINATE\n               NUM_VAL = 1\n               VALUE = 90.0\n            END_OBJECT = NORTHBOUNDINGCOORDINATE\n            OBJECT = EASTBOUNDINGCOORDINATE\n               NUM_VAL = 1\n               VALUE = 180.0\n            END_OBJECT = EASTBOUNDINGCOORDINATE\n            OBJECT = SOUTHBOUNDINGCOORDINATE\n               NUM_VAL = 1\n               VALUE = -90.0\n            END_OBJECT = SOUTHBOUNDINGCOORDINATE\n         END_GROUP = BOUNDINGRECTANGLE\n      END_GROUP = HORIZONTALSPATIALDOMAINCONTAINER\n   END_GROUP = SPATIALDOMAINCONTAINER\n   GROUP = RANGEDATETIME\n      OBJECT = RANGEBEGINNINGDATE\n         NUM_VAL = 1\n         VALUE = \"2002-06-19\"\n      END_OBJECT = RANGEBEGINNINGDATE\n      OBJECT = RANGEBEGINNINGTIME\n         NUM_VAL = 1\n         VALUE = \"00:29:47.10Z\"\n      END_OBJECT = RANGEBEGINNINGTIME\n      OBJECT = RANGEENDINGDATE\n         NUM_VAL = 1\n         VALUE = \"2002-06-20\"\n      END_OBJECT = RANGEENDINGDATE\n      OBJECT = RANGEENDINGTIME\n         NUM_VAL = 1\n         VALUE = \"00:24:01.75Z\"\n      END_OBJECT = RANGEENDINGTIME\n   END_GROUP = RANGEDATETIME\n   GROUP = PGEVERSIONCLASS\n      OBJECT = PGEVERSION\n         NUM_VAL = 1\n         VALUE = \"02\"\n      END_OBJECT = PGEVERSION\n   END_GROUP = PGEVERSIONCLASS\nEND_GROUP = INVENTORYMETADATA\nEND\n"
          },
          {
            "name": "StructMetadata.0",
            "storage_type": "NC_CHAR",